{
	"$schema": "task_schema.json",
	"task_type": "Sentiment",
	"train_file": {
		"file_path": "/users/data/d3m/datasets/training_datasets/LL1/LL1_apple_sentiment_analysis/LL1_apple_sentiment_analysis_dataset/tables/learningData.csv",
		"file_type": "csv",
		"file_header": true
	},
	"documents"	: {
		"primary_document": {
			"column_indices": [
				1
			]
		}
	},
	"target": {
		"column_index": 2,
		"target_type": "classification",
		"num_classes": 4
	}
}